Index;Abstract;Title;Authors;Year;Source title;Cited by;DOI;Link;Affiliations;Author Keywords;Index Keywords;bothKeywords;country;Dataset name;Data type;open or credentialed;Own Dataset;Authors Nationality;SA authors
225;"Background: Pregnancy in adolescents is a worldwide health problem and has been mostly common in poor populations. It is not clear if socioeconomic or biological factors are the main determinants of perinatal adverse outcomes in pregnant adolescents. Adolescents under 15 years old may present a high growth rate which may contribute to impair fetal growth. Our aim is to compare perinatal characteristics among early (aged 10 to 14 years) and late (aged 15 to 19 years) pregnant adolescents. Methods. A cross-sectional study was performed using data from Pernambuco State 2009, obtained from DATASUS/SISNAC, a Brazilian Government, open-access public health database. Maternal and neonatal outcomes were compared between early (aged 10-14 years) and late (aged 15-19 years) pregnant adolescents. Family income was compared between early and late pregnant adolescents using a sample of 412 subjects evaluated at Instituto de Medicina Integral Prof. Fernando Figueira (IMIP) during 2011. Statistical comparisons were made using the chi-square test was used with a significant level of 0.05; bivariate and multivariate analysis were performed. This project was approved by the Institutional Ethics Review Board. Results: Data from 31,209 pregnant adolescents were analyzed. 29,733 (95.2%) were aged 15 to 19 years and 1,476 (4.7%) were aged 10 to 14 years. There were significant differences with respect to marital status, education level and number of prenatal visits of mothers aged 10 to 14 years compared to 15 to 19 years. Of importance, early adolescents had a greater rate of neonates born premature and with low birth weight. Prematurity and low birth weight remained statistically significant after multivariate analysis. Conclusions: Early aged adolescents may have an increased risk of prematurity and low birth weight. These findings highlight the potential role of biological factors in newborn outcomes in pregnant adolescents. © 2012 Alves et al.; licensee BioMed Central Ltd.";Perinatal characteristics among early (10-14 years old) and late (15-19 years old) pregnant adolescents;Alves J.G.B., Cisneiros R.M.R., Dutra L.P.F., Pinto R.A.;2012;BMC Research Notes;23;10.1186/1756-0500-5-531;https://www.scopus.com/inward/record.uri?eid=2-s2.0-84866538161&doi=10.1186%2f1756-0500-5-531&partnerID=40&md5=e6ef450cabfe550e1f4930a32d440686;"Instituto de Medicina Integral Prof. Fernando Figueira (IMIP), Rua dos Coelhos 300, Boa Vista, Recife PE, 50070-550, Brazil; Universidade Do Vale Do São Francisco (UNIVASF), Campos Universitário, Av. José de Sá Manisoba, s/n, Petrolina, PE, 56304-205, Brazil; Faculdade Pernambucana de Saúde (FPS), Av. Jean Emile Favre, 422, Imbiribeira, Recife, PE, 51200-060, Brazil";"Adolescent; Low birth weight; Pregnancy; Prematurity; Socioeconomic condition";"adolescent; adolescent pregnancy; adult; article; Brazil; child; cross-sectional study; educational status; factual database; female; human; income; low birth weight; male; multivariate analysis; newborn; pathophysiology; perinatal care; pregnancy; pregnancy complication; prematurity; risk; statistics; Adolescent; Brazil; Child; Cross-Sectional Studies; Databases, Factual; Educational Status; Female; Humans; Income; Infant, Low Birth Weight; Infant, Newborn; Infant, Premature; Male; Multivariate Analysis; Perinatal Care; Pregnancy; Pregnancy Complications; Pregnancy in Adolescence; Risk; Young Adult";"Adolescent;Low birth weight;Pregnancy;Prematurity;Socioeconomic condition;adolescent pregnancy;adult;article;Brazil;child;cross-sectional study;educational status;factual database;female;human;income;male;multivariate analysis;newborn;pathophysiology;perinatal care;pregnancy complication;risk;statistics;Cross-Sectional Studies;Databases, Factual;Humans;Infant, Low Birth Weight;Infant, Newborn;Infant, Premature;Pregnancy Complications;Pregnancy in Adolescence;Young Adult";Brazil;DATASUS/SINASC;tabular;open;No;Brazil;yes
227;The COVID-19 pandemic recently challenges worldwide health system. Many countries have been establishing several rules in order to fight against the expected exponentially growth of affected people. After some weeks hospital bed occupancy started to grow because of infected people and this demand can potentially overlap hospital bed capacity. In this scenario, doctors would have to decide who should be treated and patients without adequate treatment can increase number of deaths. Thus, in order to avoid that patient demand overlap hospital bed capacity, this research propose a forecast and simulation approach in order to provide the number of intensive care beds and health care professionals that could be available in a short-term of 21 days ahead taking into account 3 patient demand scenarios. This research is applied to Rio de Janeiro city (Brazil) and all records were retrieved from Rio de Janeiro public database. Hospital length of stay (LOS) records were obtained with Rio de Janeiro City Health Department (RJHD). We concluded that to open the number of new intensive care unit (UCI) beds proposed by the government is lower than expected admission on the worst scenario. © 2021, The Author(s), under exclusive license to Springer Nature Switzerland AG.;Planning Intensive Care Resources: A Forecast and Simulation Approach Due COVID-19 Pandemic in Rio de Janeiro City;Assad D.B.N., Cara J., Ortega-Mier M., Spiegel T., Ramos L.C.F.;2021;Springer Proceedings in Mathematics and Statistics;0;10.1007/978-3-030-78570-3_41;https://www.scopus.com/inward/record.uri?eid=2-s2.0-85115137338&doi=10.1007%2f978-3-030-78570-3_41&partnerID=40&md5=72602eeeed233740ebf8f2de3018647c;"Universidad Politécnica de Madrid, Madrid, Spain; Universidade Do Estado Do Rio de Janeiro, Rio de Janeiro, Brazil";"Forecast; Health care operation management; Resource planning; Simulation";"Hospital beds; Intensive care units; Government IS; Health care professionals; Health systems; Intensive care; Intensive care resources; Length of stay; Public database; Simulation approach; Patient treatment";"Forecast;Health care operation management;Resource planning;Simulation;Hospital beds;Intensive care units;Government IS;Health care professionals;Health systems;Intensive care;Intensive care resources;Length of stay;Public database;Simulation approach;Patient treatment";"Spain;Brazil";Rio de Janeiro City Health Department - COVID dashboard;tabular;open;No;Brazil, Spain;yes
234;Background Knowledge regarding the modifiable risk factors of dementia is fundamental to guide public health policy. We aimed to estimate the population attributable fraction of modifiable risk factors of dementia among adults from a nationwide epidemiological study. Methods We used the public database of the Brazilian Longitudinal Study of Aging (ELSI-Brazil) to calculate the Population Attributable Fraction (PAF) for ten risk factors, including education level, hearing loss, hypertension, alcohol consumption, obesity, active smoking, depression, social isolation, physical inactivity, and diabetes. PAF was estimated for this sample after accounting for the communality of each risk factor. Findings The ten preventable risk factors for dementia accounted for 50 center dot 5% of the Population Attributable Fraction in Brazil. Hearing loss (14 center dot 2%), physical inactivity (11 center dot 2%), and hypertension (10 center dot 4%) accounted for the highest PAF among all the risk factors. Considerable variation in the relative contribution of the different risk factors was found in different regions. Interpretation This study might provide an opportunity to change the impact of dementia in Brazil. By targeting modifiable risk factors of dementia, the health of individuals in Brazil might be considerably improved. Copyright (c) 2022 The Author(s). Published by Elsevier Ltd. This is an open access article under the CC BY-NC-ND license (http://creativecommons.org/licenses/by-nc-nd/4.0/);Preventable risk factors of dementia: Population attributable fractions in a Brazilian population-based study;Borelli, W.V., Leotti, V.B., Strelow, M.Z., Chaves, M.L.F., Castilhos, R.M.;2022;LANCET REGIONAL HEALTH-AMERICAS;1;10.1016/j.lana.2022.100256;https://elsi.cpqrr.fiocruz.br/;"[Borelli, Wyllians Vendramini; Strelow, Matheus Zschornack; Fagundes Chaves, Marcia Lorena; Castilhos, Raphael Machado] Hosp Clin Porto Alegre, Ctr Neurol Cognit & Comportamento, Serv Neurol, Rua Ramiro Barcelos, BR-90035903 Porto Alegre, RS, Brazil; [Leotti, Vanessa Bielefeldt] Hosp Clin Porto Alegre, Unidade Bioestat, Porto Alegre, RS, Brazil; [Leotti, Vanessa Bielefeldt] Univ Fed Rio Grande do Sul, Dept Estat, Porto Alegre, RS, Brazil";"Dementia; Modifiable risk factors; Prevention; Public health system; Health providers";"MIDDLE-INCOME COUNTRIES; CARE";"Dementia;Modifiable risk factors;Prevention;Public health system;Health providers;MIDDLE-INCOME COUNTRIES;CARE";Brazil;ESLI;Tabular;credentialed;No;Brazil;yes
236;Following the creation of the Brazilian Unified National Health System (SUS), the Brazilian Health Informatics Department (DATASUS) was established in 1991, aimed at organizing information systems and databases in health. Online data access and viewing is free and open, using tables and graphs of aggregate data and access to raw data. However, the current form of data access does not fully meet the demands by health system administrators and other users for a flexible, user-friendly tool that allows dealing with various relevant health issues in the knowledge search and decision-making. We propose an ancillary system capable of generating monthly summary reports that are easy to access and understand, with an emphasis on viewing information through graphs and maps. © 2017, Fundacao Oswaldo Cruz. All rights reserved.;Proposal for an epidemiological observatory in the Brazilian Unified National Health System [Proposta de um observatório epidemiológico do Sistema Único de Saúde] [Propuesta de un observatorio epidemiológico del Sistema Único de Salud brasileño];De Freitas Saldanha R., Bastos R.R., Bustamante-Teixeira M.T., Leite I.C.G., Campos E.M.S.;2017;Cadernos de Saude Publica;0;10.1590/0102-311x00113216;https://www.scopus.com/inward/record.uri?eid=2-s2.0-85010298750&doi=10.1590%2f0102-311x00113216&partnerID=40&md5=91d7841885f7b94c570219653b2ac850;"Universidade Federal de Juiz de Fora, Juiz de Fora, Brazil; Instituto de Ciências Exatas, Universidade Federal de Juiz de Fora, Juiz de Fora, Brazil; Faculdade de Medicina, Universidade Federal de Juiz de Fora, Juiz de Fora, Brazil";"Algorithms; Information Dissemination; Information Systems; Internet";"administrative personnel; chemical binding; data base; decision making; human; information dissemination; information system; Internet; medical informatics; Brazil; computer interface; devices; information retrieval; information system; Internet; medical informatics; procedures; system analysis; Brazil; Decision Making; Humans; Information Storage and Retrieval; Information Systems; Internet; Medical Informatics; Systems Integration; User-Computer Interface";"Algorithms;Information Dissemination;Information Systems;Internet;administrative personnel;chemical binding;data base;decision making;human;information system;medical informatics;Brazil;computer interface;devices;information retrieval;procedures;system analysis;Humans;Information Storage and Retrieval;Systems Integration;User-Computer Interface";Brazil;DATASUS;tabular;open;No;Brazil;yes
241;Background: From 2006 to 2017, the Brazilian federal government provided free of charge traditional insulins for diabetes treatment. This involved public tendering by the Department of Health Logistics of the Ministry of Health (DLOG-MOH) and the reimbursement after direct contracting for supply with commercial private retailers (Brazilian Popular Pharmacy Program — PFPB). Objective: We aim to describe the budget of the Brazilian federal government committed to for the acquisition of insulin, as well as corresponding prices and treatment availability from 2009 to 2017. Methods: Insulin volume and expenditure data were obtained in official administrative databases and in the Electronic System of the Information Service to Citizens. Data were analyzed according to the total provision by the federal government, DLOG-MOH and PFPB. Moreover, data were presented according to insulin type. Volumes were calculated in number of defined daily doses (DDD)/1,000 inhabitants/day. Results: Budgetary commitments due to insulin over nine years amounted to U$1,027 billion in 2017, with an approximate average of U$114.1 million per year. DLOG-MOH was the main insulin provider, despite the increase in PFPB provision along period. DLOG-MOH and PFBP together provided an average of 6.08 DDD/1000 inhabitants/day for nine years. Average prices in PFPB were higher than those in the DLOG series, with a downward trend over the years, narrowing to 2.7 times in 2017, when compared to 2009. Conclusions: Brazil evidenced a moderately sustainable and effective, albeit imperfect, policy for public provision of traditional insulins in the period preceding mandatory free supply of insulin analogues. Future studies must address treatment availability and financial sustainability in the new scenario. © 2020, Assocaicao Brasileira de Pos, Gradacao em Saude Coletiva. All rights reserved.;Public financing of human insulins in Brazil: 2009-2017 [Financiamento público de insulinas humanas no Brasil: 2009-2017];Dias L.L.S., Dos Santos M.A.B., Osorio-De-castro C.G.S.;2020;Revista Brasileira de Epidemiologia;2;10.1590/1980-549720200075;https://www.scopus.com/inward/record.uri?eid=2-s2.0-85087717063&doi=10.1590%2f1980-549720200075&partnerID=40&md5=acf5cb1dee6666100446274e3339eeb2;National School of Public Health, Fundação Oswaldo Cruz, Rio de Janeiro, RJ, Brazil;"Diabetes mellitus; Drug price; Healthcare financing; Insulin; Supply";"insulin; Brazil; diabetes mellitus; economics; financial management; health care cost; human; Brazil; Diabetes Mellitus; Financing, Government; Health Expenditures; Humans; Insulin";"Diabetes mellitus;Drug price;Healthcare financing;Insulin;Supply;Brazil;economics;financial management;health care cost;human;Financing, Government;Health Expenditures;Humans";Brazil;SIASG;tabular;open;No;Brazil;yes
246;Introduction: Antipsychotics are widely prescribed for patients with schizophrenia. The Brazilian public health system provides these patients free of charge to patients and it is pertinent to evaluate their benefits. Objective: To evaluate the effectiveness of olanzapine and risperidone in the treatment of patients with schizophrenia in the real-world and assessing risk factors for their discontinuation through a national non-concurrent cohort with 16 years of follow-up. Methods: Three SUS administrative databases were integrated by deterministic-probabilistic linkage. After patients were matched (1:1) for psychiatric hospitalization, year of receiving the antipsychotic, sex, and age, considering either olanzapine or risperidone at study entry. Kaplan-Meier was used to estimate the cumulative probabilities of discontinuation of treatment and associated factors were identified. Sensitivity analyses were performed. Results: 3416 pairs of patients were included. Olanzapine had a longer time until discontinuation of treatment (p = 0.021), and risperidone had a higher risk of discontinuation (p = 0.021). Among patients persistent for at least 24 months, there was no statistically significant difference. Conclusion: Olanzapine demonstrated superior real-world effectiveness over risperidone, in terms of survival and psychiatric hospitalization. This superiority was not sustained in all analyses. © 2020 Informa UK Limited, trading as Taylor & Francis Group.;"Real-world effectiveness of olanzapine and risperidone in the treatment of schizophrenia in Brazil over a 16-year follow-up period; findings and implications";Barbosa W.B., Gomes R.M., Godman B., Acurcio F.D.A., Guerra Junior A.A.;2021;Expert Review of Clinical Pharmacology;5;10.1080/17512433.2021.1865799;https://www.scopus.com/inward/record.uri?eid=2-s2.0-85098648604&doi=10.1080%2f17512433.2021.1865799&partnerID=40&md5=fe57749e9d267973f1c599fcd4659573;"Department of Social Pharmacy, College of Pharmacy, Federal University of Minas Gerais, Belo Horizonte, Brazil; SUS Collaborating Centre-Technology Assessment and Excellence in Health (CCATES/UFMG), Federal University of Minas Gerais, Belo Horizonte, Brazil; Strathclyde Institute of Pharmacy and Biomedical Sciences, University of Strathclyde, Glasgow, United Kingdom; Division of Clinical Pharmacology, Karolinska, Karolinska Institute, Stockholm, Sweden; School of Pharmacy, Sefako Makgatho Health Sciences University, Garankuwa, South Africa";"Antipsychotics; Brazil; databases; olanzapine; real-world effectiveness; risperidone; schizophrenia";"atypical antipsychotic agent; clozapine; olanzapine; quetiapine; risperidone; ziprasidone; neuroleptic agent; olanzapine; risperidone; adult; aged; Article; Brazil; catatonic schizophrenia; cohort analysis; data base; drug efficacy; drug withdrawal; female; follow up; geographic origin; groups by age; hebephrenia; hospitalization; human; intention to treat analysis; major clinical study; male; mental hospital; multivariate analysis; paranoid schizophrenia; postschizophrenic depression; prescription; psychopharmacotherapy; residual schizophrenia; risk factor; schizophrenia; simple schizophrenia; survival; treatment withdrawal; undifferentiated schizophrenia; univariate analysis; adolescent; comparative study; factual database; middle aged; public health; schizophrenia; time factor; treatment outcome; young adult; Adolescent; Adult; Aged; Antipsychotic Agents; Brazil; Cohort Studies; Databases, Factual; Female; Follow-Up Studies; Hospitalization; Humans; Male; Middle Aged; National Health Programs; Olanzapine; Risk Factors; Risperidone; Schizophrenia; Time Factors; Treatment Outcome; Young Adult";"Antipsychotics;Brazil;databases;olanzapine;real-world effectiveness;risperidone;schizophrenia;atypical antipsychotic agent;clozapine;quetiapine;ziprasidone;neuroleptic agent;adult;aged;Article;catatonic schizophrenia;cohort analysis;data base;drug efficacy;drug withdrawal;female;follow up;geographic origin;groups by age;hebephrenia;hospitalization;human;intention to treat analysis;major clinical study;male;mental hospital;multivariate analysis;paranoid schizophrenia;postschizophrenic depression;prescription;psychopharmacotherapy;residual schizophrenia;risk factor;simple schizophrenia;survival;treatment withdrawal;undifferentiated schizophrenia;univariate analysis;adolescent;comparative study;factual database;middle aged;public health;time factor;treatment outcome;young adult;Antipsychotic Agents;Cohort Studies;Databases, Factual;Follow-Up Studies;Humans;National Health Programs;Risk Factors;Time Factors";Brazil;SIH/SUS, SIA/SUS, SIM;tabular;open;No;Brazil, UK, Sweden, South Africa;yes
248;Background Leprosy is an infectious disease that mostly affects underserved populations. Although it has been largely eliminated, still about 200'000 new patients are diagnosed annually. In the absence of a diagnostic test, clinical diagnosis is often delayed, potentially leading to irreversible neurological damage and its resulting stigma, as well as continued transmission. Accelerating diagnosis could significantly contribute to advancing global leprosy elimination. Digital and Artificial Intelligence (AI) driven technology has shown potential to augment health workers abilities in making faster and more accurate diagnosis, especially when using images such as in the fields of dermatology or ophthalmology. That made us start the quest for an AI-driven diagnosis assistant for leprosy, based on skin images. Methods Here we describe the accuracy of an AI-enabled image-based diagnosis assistant for leprosy, called AI4Leprosy, based on a combination of skin images and clinical data, collected following a standardized process. In a Brazilian leprosy national referral center, 222 patients with leprosy or other dermatological conditions were included, and the 1229 collected skin images and 585 sets of metadata are stored in an open-source dataset for other researchers to exploit. Findings We used this dataset to test whether a CNN-based AI algorithm could contribute to leprosy diagnosis and employed three AI models, testing images and metadata both independently and in combination. AI modeling indicated that the most important clinical signs are thermal sensitivity loss, nodules and papules, feet paresthesia, number of lesions and gender, but also scaling surface and pruritus that were negatively associated with leprosy. Using elastic-net logistic regression provided a high classification accuracy (90%) and an area under curve (AUC) of 96.46% for leprosy diagnosis. Interpretation Future validation of these models is underway, gathering larger datasets from populations of different skin types and collecting images with smartphone cameras to mimic real world settings. We hope that the results of our research will lead to clinical solutions that help accelerate global leprosy elimination. Copyright (c) 2022 The Authors. Published by Elsevier Ltd. This is an open access article under the CC BY-NC-ND license (http://creativecommons.org/licenses/by-nc-nd/4.0/);Reimagining leprosy elimination with AI analysis of a combination of skin lesion images with demographic and clinical data;Barbieri, R.R., Xu, Y.X., Setian, L., Souza-Santos, P.T., Trivedi, A., Cristofono, J., Bhering, R., White, K., Sales, A.M., Miller, G., Nery, J.A.C., Sharman, M., Bumann, R., Zhang, S., Goldust, M., Sarno, E.N., Mirza, F., Cavaliero, A., Timmer, S., Bonfiglioli, E., Smith, C., Scollard, D., Navarini, A.A., Aerts, A., Ferres, J.L., Moraes, M.O.;2022;LANCET REGIONAL HEALTH-AMERICAS;1;10.1016/j.lana.2022.100192;https://arcadados.fiocruz.br/dataset.xhtml?persistentId=doi:10.35078/1PSIEL;"[Barbieri, Raquel R.; Souza-Santos, Paulo Thiago; Bhering, Ricardo; Sales, Anna M.; Nery, Jose Augusto C.; Sarno, Euzenir N.; Moraes, Milton O.] Fundacao Oswaldo Cruz, FIOCRUZ, Lab Hanseniase Inst Oswaldo Cruz, Rio De Janeiro, Brazil; [Xu, Yixi; Trivedi, Anusua; Cristofono, Jim; White, Kevin; Miller, Geralyn; Sharman, Michael; Bumann, Richard; Zhang, Shun; Timmer, Sander; Bonfiglioli, Elena; Ferres, Juan Lavista] Microsoft Corp, One Microsoft Way,One Microsoft Way, Redmond, WA 98052 USA; [Setian, Lucy; Mirza, Fareed; Cavaliero, Arielle; Aerts, Ann] Novartis Fdn, Basel, Switzerland; [Goldust, Mohamad; Navarini, Alexander A.] Univ Basel, Basel, Switzerland; [Goldust, Mohamad] Univ Med Ctr Mainz, Dept Dermatol, Mainz, Germany; [Smith, Cairns] Univ Aberdeen, Aberdeen, Scotland";"Leprosy; Artificial intelligence; AI; Image-based diagnosis; Dermatology; Skin lesions; AI4leprosy";;"Leprosy;Artificial intelligence;AI;Image-based diagnosis;Dermatology;Skin lesions;AI4leprosy";"Brazil;United States;Switzerland;Germany;United Kingdom";AI4Leprosy;images;open;Yes;Brazil, Switzerland, Scotland, USA, Germany;yes
