Index;Abstract;Title;Authors;Year;Source title;Cited by;DOI;Link;Affiliations;Author Keywords;Index Keywords;bothKeywords;country;Dataset name;Data type;open or credentialed;Own Dataset;Authors Nationality;SA authors
11;"Background Mammographic screening has been used to reduce breast cancer mortality worldwide and remains the main modality for the early detection of this disease. Women from low and middle-income countries still lack access to periodic mammograms and efficient health care. This cross-sectional study aimed to explore opportunistic mammographic coverage in Brazil, while considering the privately insured population and its association with early breast cancer (EBC) detection. Methods Data on population, gross domestic product (GDP), number of mammograms performed under the Sistema Único de Saúde (SUS) public health system or private system, and women diagnosed with early-stage breast cancer from 2010 to 2019 were retrieved from publicly available databases. Results A total of 39 555 636 mammograms with an average of 3 955 564 ± 395 704 mammograms were obtained per year from 2010 to 2019 in Brazil. Most examinations (58.6%) were performed in the target population (50-69 years old), while 32% were performed in women aged 40-49, and 9.4% were performed in women <40 years or >70 years of age. The 10-year mammogram coverage was 30.6% in the target population and 24.8% in the population aged 40-49 years, with significant variation across states and municipalities. The overall EBC detection rates in Brazil were 30.6% in populations aged 50-70 and 24.8% in those aged 40-50 years. We observed a positive correlation between coverage and EBC detection rate (r = 0.68; P = 0.0001 (50-70 years) and r = 0.75; P < 0.0001 (40-50 years)). According to the GDP, the municipalities with higher GDP per capita had higher mammogram coverage (P < 0.0001). Conclusions The coverage of mammographic screening for women under the SUS is far below the international guidelines. Additionally, a significant number of mammograms have been performed in non-target populations. This scenario reflects the problematic screening programs in developing countries and reflects low rates of EBC diagnosis. As Brazil is a continental country with heterogeneous socioeconomic indicators, we observed significant variations in the number of mammograms performed by age groups when separated by states and municipalities. Even when considering supplemental health system coverage, municipalities with higher GDP per capita were associated with higher mammogram coverage. © 2022 The Author(s) JoGH 2022 ISoGH";10-year opportunistic mammographic screening scenario in Brazil and its impact on breast cancer early detection: a nationwide population-based study;Cuoghi I.C., da Silva Soares M.F., dos Santos G.M.C., Candido-dos-Reis F.J., Poli-Neto O.B., de Andrade J.M., Bosquesi P.L., Orlandini L.F., Tiezzi D.G.;2022;Journal of Global Health;1;10.7189/jogh.12.04061;https://www.scopus.com/inward/record.uri?eid=2-s2.0-85139880822&doi=10.7189%2fjogh.12.04061&partnerID=40&md5=55ff568f30ae92b999879fab516f6416;"CEPAM – Centro de Pesquisa Avançada em Medicina da UNILAGO, Faculdade de Medicina UNILAGO, União das Faculdades dos Grandes Lagos, São Paulo, São José do Rio Preto, Brazil; Faculdade de Medicina de Ribeirão Preto FMRP – USP, São Paulo, Ribeirão Preto, Brazil; Laboratory for Translational Data Science - University of São Paulo, São Paulo, Brazil; Faculdade de Ciências Farmacêuticas UNESP, São Paulo, Araraquara, Brazil";;"adult; aged; Brazil; breast tumor; cross-sectional study; diagnostic imaging; early cancer diagnosis; female; human; mammography; middle aged; Adult; Aged; Brazil; Breast Neoplasms; Cross-Sectional Studies; Early Detection of Cancer; Female; Humans; Mammography; Middle Aged";"adult;aged;Brazil;breast tumor;cross-sectional study;diagnostic imaging;early cancer diagnosis;female;human;mammography;middle aged;Breast Neoplasms;Cross-Sectional Studies;Early Detection of Cancer;Humans";Brazil;"- Brazilian Institute of Geography and Statistics - IBGE. Brazilian Census ( https://cidades.ibge.gov.br/brasil/panorama. )
- Brazilian Public Health System Database (DATASUS) (https://datasus.saude.gov.br/)";Tabular;Open;No;Brazil;yes
14;"Background: The number of transplants performed relies, partially, on recipients' variables on the waiting list. The goal of this study was to compare recipients from a high-volume liver center in Argentina with the rest of the country. Methods: This study was a retrospective analysis of liver transplant recipients nationally between January 2013 and April 2017. It involved extracting data from the open database CRESI-SINTRA (the Argentinian database of the National Procurement Organization, an equivalent to the United Network for Organ Sharing); expressing results by percentages, medians, and interquartile ranges (IQRs); and comparing the national population with the population transplanted at Hospital El Cruce (HEC). The Mann-Whitney U test was used for analysis. Results: Nationally, 1434 liver transplants were performed. A total of 177 (12.34%) were emergency status; 811 (56.6%) were by the Model for End-Stage Liver Disease (MELD) (n = 759)/PELD (Pediatric End-Stage Liver Disease) (n = 52), with a median graft assignment position of 5 (IQR, 3–10) in 57.2 days (IQR, 11–217). Median MELD access was 29 points (IQR, 24–33). A total of 446 (31.1%) had MELD exceptions; 249 (55.8%) of these were due to Milan hepatocellular carcinoma. At the HEC, 167 liver transplantations were performed; 26 (15.6%) were emergency status and 97 (58.1%) by MELD (none PELD). Their median graft assignment position was 4 (IQR, 4–16) in 19.1 days (IQR, 4–90); median MELD access was 28 points (IQR, 24–31). Forty-five patients (26.9%) had MELD exceptions; 31 (68.9%) were due to hepatocellular carcinoma. Conclusions: Our center has a larger proportion of recipients transplanted by emergency status and MELD, similar MELD access, and less waiting list time, reflecting our wide policy of liver graft acceptance. © 2017 Elsevier Inc.";Access to Grafts in a Liver Transplant Center: Does It Rely on the Severity of the Waiting List Population?;Daciuk N.I., Quinonez E.G., Poupard M., Vergara Sandoval R.M., Mattera F.J.;2018;Transplantation Proceedings;0;10.1016/j.transproceed.2017.12.049;https://www.scopus.com/inward/record.uri?eid=2-s2.0-85044141657&doi=10.1016%2fj.transproceed.2017.12.049&partnerID=40&md5=ad43530764085e0a4c696e6970fec61a;Liver Transplant Unit, Hospital El Cruce, Florencio Varela, Argentina;;"adult; Argentina; Article; child; comparative study; controlled study; digestive system disease assessment; emergency care; groups by age; health care access; health care facility; hospital admission; human; liver cell carcinoma; liver graft; liver transplant center; liver transplantation; major clinical study; Model For End Stage Liver Disease Score; Pediatric End Stage Liver Disease; priority journal; retrospective study; end stage liver disease; female; hospital admission; liver transplantation; male; middle aged; severity of illness index; statistics and numerical data; Argentina; End Stage Liver Disease; Female; Humans; Liver Transplantation; Male; Middle Aged; Retrospective Studies; Severity of Illness Index; Waiting Lists";"adult;Argentina;Article;child;comparative study;controlled study;digestive system disease assessment;emergency care;groups by age;health care access;health care facility;hospital admission;human;liver cell carcinoma;liver graft;liver transplant center;liver transplantation;major clinical study;Model For End Stage Liver Disease Score;Pediatric End Stage Liver Disease;priority journal;retrospective study;end stage liver disease;female;male;middle aged;severity of illness index;statistics and numerical data;Humans;Retrospective Studies;Waiting Lists";Argentina;Liver transplant recipient: open database CRESI-SINTRA (the Argentinian database of the National Procurement Organization). Through the sintra.incucai.gov.ar;Tabular;Open;No;Argentina;yes
16;"Different countries have adopted various control measures for the COVID-19 pandemic in different periods, and as the virus continues to mutate, the progression of the pandemic and preventive measures adopted have varied dynamically over time. Thus, quantitative analysis of the dynamic impact of different factors such as vaccination, mutant virus, social isolation, etc., on transmission and predicting pandemic progress has become a difficult task. To overcome the challenges above and enable governments to formulate reasonable countermeasures against the ongoing COVID-19 pandemic, we integrate several mathematical methods and propose a new adaptive multifactorial and geographically diverse epidemiological model based on a modified version of the classical susceptible-exposed-infectious-recovered (SEIR) model. Based on public datasets, a multi-center study was carried out considering 21 regions. First, a retrospective study was conducted to predict the number of infections over the next 30 days in 13 representative pandemic areas worldwide with an accuracy of 87.53%, confirming the robustness of the proposed model. Second, the impact of three scenarios on COVID-19 was quantified based on the scalability of the model: two different vaccination regimens were analyzed, and it was found that the number of infections would progressively decrease over time after vaccination; variant virus caused a 301.55% increase in infections in the United Kingdom; and 3-tier social lockdown in the United Kingdom reduced the infections by 47.01%. Third, we made short-term prospective predictions for the next 15 and 30 days for six countries with severe COVID-19 transmission and the predicted trend is accurate. This study is expected to inform public health responses. Code and data are publicly available at https://github.com/yuanyuanpei7/covid-19. Copyright © 2022 Pei, Li, Xu and Xu.";Adaptive Multi-Factor Quantitative Analysis and Prediction Models: Vaccination, Virus Mutation and Social Isolation on COVID-19;Pei Y., Li J., Xu S., Xu Y.;2022;Frontiers in Medicine;1;10.3389/fmed.2022.828691;https://www.scopus.com/inward/record.uri?eid=2-s2.0-85127605132&doi=10.3389%2ffmed.2022.828691&partnerID=40&md5=2857ec2afdefba9e3450a30f17fa10db;"Clinical Data Center, Guangzhou Women and Children's Medical Center, Guangzhou Medical University, Guangzhou, China; Department of Infectious Diseases, Guangzhou Women and Children's Medical Center, Guangzhou Medical University, Guangzhou, China";"adaptive multi-factor model; COVID-19; social isolation; vaccination; virus mutation";"SARS-CoV-2 vaccine; Article; Brazil; coronavirus disease 2019; Germany; human; India; Italy; lockdown; major clinical study; pandemic; prediction; prospective study; public health; quantitative analysis; quarantine; retrospective study; social isolation; susceptible population; Turkey (republic); United Kingdom; United States; vaccination; virus mutation";"adaptive multi-factor model;COVID-19;social isolation;vaccination;virus mutation;SARS-CoV-2 vaccine;Article;Brazil;coronavirus disease 2019;Germany;human;India;Italy;lockdown;major clinical study;pandemic;prediction;prospective study;public health;quantitative analysis;quarantine;retrospective study;susceptible population;Turkey (republic);United Kingdom;United States";All (but just used Brazil and Peru);"- COVID-19 Dashboard by the Center for Systems Science and
Engineering (CSSE) at Johns Hopkins University (JHU).
Available online at: https://coronavirus.jhu.edu/map.html
- World Bank. COVID-19 (Coronavirus) Response. World Bank (2020).
Available online at: https://www.worldbank.org/en/topic/health/coronavirus";Tabular;Open;No;China;yes
18;The current spreading of the SARS-CoV-2 pandemic had put all the scientific community in alert. Even in the presence of different vaccines, the active virus still represents a global challenge. Due to its rapid spreading and uncertain nature, having the ability to forecast its dynamics becomes a necessary tool in the development of fast and efficient health policies. This study implements a temporal convolutional neural network (TCN), trained with the open covid-19 data set sourced by the Health Ministry of Peru (MINSA) on the Peruvian coast. In order to obtain a robust model, the data was divided into validation and training sets, without overlapping. Using the validation set the model architecture and hyper-parameters were found with Bayesian optimization. Using the optimal configuration the TCN was trained with a test and forecasting window of 15 days ahead. Predictions on available data were made from March 06, 2020 until April 13, 2021, whereas forecasting from April 14 to April 29, 2021. In order to account for uncertainty, the TCN estimated the 5%, 50% and 95% prediction quantiles. Evaluation was made using the MAE, MAD, MSLE, RMSLE and PICP metrics. Results suggested some variations in the data distribution. Test results shown an improvement of 24.241, 0.704 and 0.422 for the MAD, MSLE and RMSLE metrics respectively. Finally, the prediction interval analysis shown an average of 97.886% and 97.778% obtained by the model in the train and test partitions.;A Deep Learning Approach to Forecast SARS-CoV-2 on the Peruvian Coast;Aguilar, I.L., Ibanez-Reluz, M., Aguilar, J.C.Z., Zavaleta-Aguilar, E.W., Aguilar, L.A.;2021;COMPUTATIONAL SCIENCE AND ITS APPLICATIONS, ICCSA 2021, PT III;0;10.1007/978-3-030-86970-0_22;;"[Luis Aguilar, I] Natl Univ Piura, Dept Math, Castilla S-N, Piura, Peru; [Ibanez-Reluz, Miguel] Cesar Vallejo Univ, Med Fac, Av Victor Larco 1770, Trujillo, Peru; [Aguilar, Juan C. Z.] Univ Fed Sao Joao del Rei, Dept Math & Stat, CP 110, BR-36301160 Sao Joao Del Rei, MG, Brazil; [Zavaleta-Aguilar, Eli W.] Sao Paulo State Univ Unesp, Campus Itapeva Rua Geraldo Alckmin 519, BR-18409010 Itapeva, SP, Brazil; [Antonio Aguilar, L.] KapAITech Res Grp, Artificial Intelligent Res, Trujillo, Peru";"Deep learning; SARS-CoV-2; Temporal convolutional neural networks; Time series data";;"Deep learning;SARS-CoV-2;Temporal convolutional neural networks;Time series data";Peru;"-Daily Covid-19 dataset: Ministry of Health in Peru (MINSA). https://www.datosabiertos.gob.pe/dataset/casos-positivos-por-covid-19-
ministerio-de-salud-minsa";Tabular;Open;No;Peru, Brazil;yes
20;Here we present a discrete-time-evolution model with one day interval to forecast the propagation of Covid-19. The proposed model can be easily implemented with daily updated data sets of the pandemic publicly available by distinct online sources. It has only two adjustable parameters and it predicts the evolution of the total number of infected people in a country for the next 14 days if parameters do not change during the analyzed period. The model incorporates the main aspects of the disease such as the fact that there are asymptomatic and symptomatic phases (both capable of propagating the virus), and that these phases take almost two weeks before the infected person status evolves to the next (asymptomatic becomes symptomatic or symptomatic becomes either recovered or dead). A striking advantage of the model for its implementation by the health sector is that it gives directly the number of total infected people in each day (in thousands, tens of thousands or hundred of thousands). Here, the model is tested with data from Brazil, UK and South Korea, presenting low error rates on the prediction of the evolution of the disease in all analyzed countries. We hope this model may be a useful tool to estimate the propagation of the disease. © 2020 Curado, Curado. This is an open access article distributed under the terms of the Creative Commons Attribution License, which permits unrestricted use, distribution, and reproduction in any medium, provided the original author and source are credited.;A discrete-time-evolution model to forecast progress of Covid-19 outbreak;Curado E.M.F., Curado M.R.;2020;PLoS ONE;3;10.1371/journal.pone.0241472;https://www.scopus.com/inward/record.uri?eid=2-s2.0-85094893022&doi=10.1371%2fjournal.pone.0241472&partnerID=40&md5=d6de27af7793830e9cf71214ed2b207e;"Centro Brasileiro de Pesquisas Físicas, Rio de Janeiro, Brazil; National Institute of Science and Technology for Complex Systems, Rio de Janeiro, Brazil; AbbVie Deutschland GmbH & Co KG, Data and Statistical Sciences (DSS), Ludwigshafen am Rhein, Germany";;"Article; asymptomatic infection; Brazil; case study; coronavirus disease 2019; discrete event simulation; disease course; epidemic; geographic distribution; human; infection rate; model; prediction; South Korea; symptom; United Kingdom; virus transmission; Betacoronavirus; Coronavirus infection; forecasting; pandemic; statistical model; time factor; virus pneumonia; Asymptomatic Infections; Betacoronavirus; Brazil; Coronavirus Infections; Forecasting; Humans; Models, Statistical; Pandemics; Pneumonia, Viral; Republic of Korea; Time Factors; United Kingdom";"Article;asymptomatic infection;Brazil;case study;coronavirus disease 2019;discrete event simulation;disease course;epidemic;geographic distribution;human;infection rate;model;prediction;South Korea;symptom;United Kingdom;virus transmission;Betacoronavirus;Coronavirus infection;forecasting;pandemic;statistical model;time factor;virus pneumonia;Asymptomatic Infections;Coronavirus Infections;Humans;Models, Statistical;Pandemics;Pneumonia, Viral;Republic of Korea;Time Factors";All (Just using Brazil in south america);Johns Hopkins University: Coronavirus Research Center. Available from: https://coronavirus.jhu.edu/map.html;Tabular;Open;No;Brazil, Germany;yes
21;Introduction Biological drugs open new possibilities to treat diseases for which drug therapy is limited, but they may be associated with adverse drug reactions (ADRs). Objective To identify the ADRs associated with the use of biological drugs in Colombia. Methods This was a retrospective study of ADR reports from 2014 to 2019, contained in the database of Audifarma SA pharmacovigilance program. The ADRs, groups of associated drugs, and affected organs were classified. Results In total, 5,415 reports of ADRs associated with biological drugs were identified in 78 Colombian cities. A total of 76.1% of the cases corresponded to women. The majority were classified as type A (55.0%) and B (28.9%), and 16.7% were serious cases. The respiratory tract was the most affected organ system (16.8%), followed by the skin and appendages (15.6%). Antineoplastic and immunomodulatory drugs accounted for 70.6% of the reports, and the drugs related to the greatest number of ADRs were adalimumab (12.2%) and etanercept (11.6%). Conclusions The reporting of ADRs has increased in recent years and these reactions are mostly classified as tyoe A or B, categorized as serious in almost one-fifth of the reported cases and associated mainly with immunomodulators and antineoplastic agents. This type of study can support decision makers in ways that benefit patient safety and interaction with health systems.;Adverse drug reactions associated with the use of biological agents;Machado-Alba, J.E., Jimenez-Morales, A.L., Moran-Yela, Y.C., Parrado-Fajardo, I.Y., Valladales-Restrepo, L.F.;2020;PLOS ONE;2;10.1371/journal.pone.0240276;;"[Enrique Machado-Alba, Jorge; Fernando Valladales-Restrepo, Luis] Univ Tecnol Pereira Audifarma SA, Grp Invest Farmacoepidemiol & Farmacovigilancia, Pereira, Risaralda, Colombia; [Enrique Machado-Alba, Jorge; Liliana Jimenez-Morales, Anyi; Carolina Moran-Yela, Yulieth] Univ Tecnol Pereira Audifarma SA, Pereira, Risaralda, Colombia; [Yadira Parrado-Fajardo, Ilsa] Univ Tecnol Pereira Audifarma SA, Grp Invest Farmacoepidemiol & Farmacovigilancia, Bogota, Colombia; [Fernando Valladales-Restrepo, Luis] Fundac Univ Autonoma Amer, Fac Med, Grp Invest Biomed, Pereira, Colombia";;"MODIFYING ANTIRHEUMATIC DRUGS; RHEUMATOID-ARTHRITIS; EVENTS; SAFETY; SURVEILLANCE";"MODIFYING ANTIRHEUMATIC DRUGS;RHEUMATOID-ARTHRITIS;EVENTS;SAFETY;SURVEILLANCE";Colombia;adverse drug reactions (ADRs) reports: Audifarma SA pharmacovigilance (dx.doi.org/10.17504/protocols.io.bkcfkstn );Tabular;Open;No;Colombia;yes
31;"Background Cancer is a leading cause of disease and death in Latin America and the Caribbean (LAC). Contemporary data on the cancer burden aims to inform effective cancer policies; this article provides an update and benchmarking of national cancer incidence and mortality estimates for the year 2020, alongside recent mortality trends in the region. Methods The number of new cancer cases and deaths were extracted from the GLOBOCAN 2020 database developed by the International Agency for Research on Cancer (IARC), and mortality data over time from IARC's cancer mortality database, New cancer cases, deaths and corresponding age-standardized rates per 100,000 person-years are presented. Random fluctuations in mortality trends by country, sex and cancer site were smoothed using LOWE-SS regression. Findings An estimated total of 1.5 million new cancer cases and 700,000 deaths occur annually in LAC, with corresponding incidence and mortality rates of 186.5 and 86.6 per 100,000. The most common cancers in 2020 were prostate (15%), breast (14%), colorectal (9%), lung (7%) and stomach (5%). Lung cancer remained the leading cause of cancer death (12%), though rates varied substantially between countries. The mortality trends of infectious-related cancers tended to decline in most countries, while rates of cancer types linked to westernization were mainly increasing. Assuming rates remain unchanged, the cancer burden in LAC will increase by 67% reaching 2.4 million new cases annually by 2040. Interpretation The cancer patterns reflect important underlying sociodemographic changes occurring over the last decades. With an increasing burden anticipated over the next decades in this region, there is a need to plan oncological service provision accordingly. Copyright (c) 2022 World Health Organization. Published by Elsevier Ltd. This is an open access article under the CC BY IGO license (http://creativecommons.org/licenses/by/3.0/igo/)";An updated profile of the cancer burden, patterns and trends in Latin America and the Caribbean;Pineros, M., Laversanne, M., Barrios, E., Cancela, M.D., de Vries, E., Pardo, C., Bray, F.;2022;LANCET REGIONAL HEALTH-AMERICAS;8;10.1016/j.lana.2022.100294;;"[Pineros, Marion; Laversanne, Mathieu; Bray, Freddie] Int Agcy Res Canc, Canc Surveillance Branch, Lyon, France; [Barrios, Enrique] Honorary Commiss Fight Canc, Natl Canc Registry, Montevideo, Uruguay; [Cancela, Marianna de Camargo] Natl Canc Inst INCA, Canc Surveillance Div, Rio De Janeiro, Brazil; [de Vries, Esther] Pontificia Univ Javeriana, Dept Clin Epidemiol & Biostat, Bogota, Colombia; [Pardo, Constanza] Natl Canc Inst, INC Bogota, Canc Surveillance Grp, Bogota, Colombia";"Neoplasms; Cancer; Global health; Epidemiology; Public health surveillance";MORTALITY;"Neoplasms;Cancer;Global health;Epidemiology;Public health surveillance;MORTALITY";All South America;"Ferlay J, Ervik M, Lam F, et al. Global Cancer Observatory: Cancer
Today. Lyon, France: International Agency for Research on Cancer;
2020. Available from: https://gco.iarc.fr/today.";Tabular;Open;No;France, Uruguay, Brazil, Colombia;yes
