Index;Abstract;Title;Authors;Year;Source title;Cited by;DOI;Link;Affiliations;Author Keywords;Index Keywords;bothKeywords;country;Dataset name;Data type;open or credentialed;Own Dataset;Authors Nationality;SA authors
123;Objective: To use publicly available secondary data to assess the impact of Brazil's Family Health Program on state level infant mortality rates (IMR) during the 1990s. Design: Longitudinal ecological analysis using panel data from secondary sources. Analyses controlled for state level measures of access to clean water and sanitation, average income, women's literacy and fertility, physicians and nurses per 10 000 population, and hospital beds per 1000 population. Additional analyses controlled for immunisation coverage and tested interactions between Family Health Program and proportionate mortality from diarrhoea and acute respiratory infections. Setting: 13 years (1990-2002) of data from 27 Brazilian states. Main results: From 1990 to 2002 IMR declined from 49.7 to 28.9 per 1000 live births. During the same period average Family Health Program coverage increased from 0% to 36%. A 10% increase in Family Health Program coverage was associated with a 4.5% decrease in IMR, controlling for all other health determinants (p<0.01). Access to clean water and hospital beds per 1000 were negatively associated with IMR, while female illiteracy, fertility rates, and mean income were positively associated with IMR. Examination of interactions between Family Health Program coverage and diarrhoea deaths suggests the programme may reduce IMR at least partly through reductions in diarrhoea deaths. Interactions with deaths from acute respiratory infections were ambiguous. Conclusions: The Family Health Program is associated with reduced IMR, suggesting it is an important, although not unique, contributor to declining infant mortality in Brazil. Existing secondary datasets provide an important tool for evaluation of the effectiveness of health services in Brazil.;Evaluation of the impact of the Family Health Program on infant mortality in Brazil, 1990-2002;Macinko J., Guanais F.C., Marinho De Souza M.D.F.;2006;Journal of Epidemiology and Community Health;246;10.1136/jech.2005.038323;https://www.scopus.com/inward/record.uri?eid=2-s2.0-29744457721&doi=10.1136%2fjech.2005.038323&partnerID=40&md5=91f3732cf13c556df3e14cfdf1b6a4cb;"Department of Nutrition, Food Studies, and Public Health, New York University, 35 West 4th Street, New York, NY 10012-1172, United States; Department of Nutrition, Food Studies, and Public Health, New York University, New York, NY, United States; Robert F Wagner Graduate School of Public Service, New York University, New York, NY, United States; Faculty of Medicine, University of Sào Paulo, Brazil; University of Cuiabá, Brazil; Secretariat of Health Surveillance, Ministry of Health of Brazil, Brazil";;"health monitoring; health services; infant mortality; mortality risk; article; Brazil; data analysis; diarrhea; ecology; family health; female fertility; health care access; health care distribution; health program; human; immunization; income; infant; infant mortality; longitudinal study; reading; respiratory tract infection; sanitation; Brazil; Child Health Services; Child, Preschool; Delivery of Health Care; Developing Countries; Family Health; Female; Health Promotion; Humans; Infant; Infant Mortality; Infant, Newborn; Logistic Models; Longitudinal Studies; Male; Pregnancy; Program Evaluation; Risk Factors; Brazil; South America";"health monitoring;health services;infant mortality;mortality risk;article;Brazil;data analysis;diarrhea;ecology;family health;female fertility;health care access;health care distribution;health program;human;immunization;income;infant;longitudinal study;reading;respiratory tract infection;sanitation;Child Health Services;Child, Preschool;Delivery of Health Care;Developing Countries;Female;Health Promotion;Humans;Infant, Newborn;Logistic Models;Longitudinal Studies;Male;Pregnancy;Program Evaluation;Risk Factors;South America";"United States;Brazil";TabNet platform - DATASUS;Tabular;Open;No;2 USA 1 Brazil;yes
124;Objectives: To propose a regional synthetic indicator (ISR) to evaluate the health system performance in Brazilian regions based on a national database source available free of charge in a global network of computers. Methods: a cross-sectional study using secondary data, considered seven variables of five dimensions in the health system (population’s health conditions, health system coverage, financing, human resources and SUS production) analyzed from a survey of 438 Brazilian regions and adopted factor analysis and cluster models, conditioned by variables, such as: socioeconomic development, offering and service complexity and which resulted in a grouping of five strata. Results: mapping and scheduling based on ISR in health regions in Brazil and a detailed analysis of different indicators that compose them. The regions that showed better performance are in the Southeast, South and Midwest. Conclusions: This article sums efforts of other authors to extend the evaluation studies in health systems in a regional level. In addition, it is expected that the researches broaden their scope and implement the discussions about the process of regionalization in order to provide health policies, a universalized access and care comprehensiveness. © 2017, Instituto Materno Infantil Professor Fernando Figueira. All rights reserved.;Evaluation performance in health regions in Brazil [Avaliação de desempenho das regiões de saúde no Brasil];Uchimura L.Y.T., Felisberto E., Fusaro E.R., Ferreira M.P., Viana A.L.D.A.;2017;Revista Brasileira de Saude Materno Infantil;5;10.1590/1806-9304201700s100012;https://www.scopus.com/inward/record.uri?eid=2-s2.0-85037844992&doi=10.1590%2f1806-9304201700s100012&partnerID=40&md5=14b5353d20b18ff8af41b53cb24d418b;"Departamento de Medicina Preventiva, Faculdade de Medicina, Universidade de São Paulo, Av. Dr. Arnaldo, 455 2º andar, São Paulo, SP  CEP: 01.246-903, Brazil; Instituto de Medicina Integral Prof. Fernando Figueira, Recife, Pernambuco, Brazil; Departamento Intersindical e Estatística e Estudos Econômicos (DIIESE), São Paulo, SP, Brazil; Fundação Sistema Estadual de Análise de Dados, São Paulo, SP, Brazil";"Health evaluation; Health management; Regionalization";;"Health evaluation;Health management;Regionalization";Brazil;DATASUS;Tabular;Open;No;5 Brazil;yes
131;Modern developments in the state-of-the-art open-source activation functions for Convolutional Neural Networks (CNNs) have broadened the selection of benchmark activations for Deep Learning (DL)-aided classification. Nevertheless, achieving discrimination of non-linear input image data in CNN is still not straightforward and it is unclear how such novel activation functions can have translational applications with tangible impact. hyper-sinh, made freely available in TensorFlow and Keras, was demonstrated as a benchmark activation function on five (N=5) datasets in its ground-breaking paper. Measuring the value from deploying this activation in a specific application is pivotal to supply the required evidence of its performance on real-life supervised DL-based image classification tasks. In this study, a CNN was for the first time combined with hyper-sinh to aid early detection of Parkinson’s Disease (PD) from discriminating pathophysiological patterns extracted from spiral drawings. Thus, the hyper-sinh activation was deployed tomaximise the separability of the input features from spiral drawings via automated pattern recognition. We demonstrate the accuracy and reliability of hyper-sinh-CNN to aid early diagnosis of PD, evaluated against other gold standard activation functions, including the recent Quantum ReLU (QReLU) and the modified Quantum ReLU (m-QReLU) that solved the ‘dying ReLU’ problem for the first time in the literature of DL. Two (N=2) benchmark datasets from the database of the Botucatu Medical School, São Paulo State University in Brazil, scaled to be in 28 by 28 pixels as the MNIST benchmark data, were used to discriminate between input image patterns of 158 subjects (53 healthy controls and 105 patients with PD) from spirals drawn on graphics tablets. Overtraining was avoided via early stopping and the models were developed and tested in TensorFlow and Keras (Python 3.6). The supervised model (hyper-sinh-CNN) could detect early Parkinson’s Disease with 81% and 91% classification accuracy from the two datasets respectively (F1-scores: 73% and 91% correspondingly). Furthermore, the model achieved high sensitivity (81% and 91%). Thus, this study validates the application of hyper-sinh to aid real-life supervised DL-based image classification, in particular early diagnosis of PD from spiral drawings. © 2021, World Scientific and Engineering Academy and Society. All rights reserved.;Ηyper-sinh-Convolutional Neural Network for Early Detection of Parkinson’s Disease from Spiral Drawings;Parisi L., Ma R., Zaernia A., Youseffi M.;2021;WSEAS Transactions on Computer Research;6;10.37394/232018.2021.9.1;https://www.scopus.com/inward/record.uri?eid=2-s2.0-85118104859&doi=10.37394%2f232018.2021.9.1&partnerID=40&md5=b0bad0cbb1bcc22c25c5b504985b9bdb;"University of Auckland Rehabilitative Technologies Association (UARTA), University of Auckland, Auckland, 1010, New Zealand; Department of Biomedical and Electronics Engineering, Faculty of Engineering and Informatics, University of Bradford, Bradford, BD7 1DP, United Kingdom";"Convolutional Neural Network; Hyper-sinh; M-arcsinh; M-QReLU; Parkinson’s Disease; QReLU";;"Convolutional Neural Network;Hyper-sinh;M-arcsinh;M-QReLU;Parkinson’s Disease;QReLU";"New Zealand;United Kingdom";Spiral HandPD and NewHandPD from Botucatu Medial School, Sao Paulo State University, Brazil;Images;Open (?) Need to confirm;No;2 New Zealand, 2 UK;no
136;"BACKGROUND: Major disparities in complications and mortality after appendectomy between countries with different income levels have not been well characterized, as comparative studies at patient level between countries are scant. This study aimed to investigate variations in postoperative complications, mortality, and failure to rescue after appendectomy between a high-income country and a low-to-middle-income country. METHODS: Hospital discharges on adult patients who underwent appendectomy were extracted from administrative databases from Colombia and 2 states of the United States (Florida and New York). Outcomes included major postoperative complications, in-hospital mortality, and failure to rescue. Univariate analyses were conducted to compare outcomes between the 2 countries. Multivariable logistic regression analyses were conducted to examine the independent effect of country on outcomes after adjustment for patient age, sex, comorbidity index, severity of appendicitis, and appendectomy route (laparoscopic/open). RESULTS: A total of 62,338 cases from Colombia and 57,987 from the United States were included in the analysis. Patients in Colombia were significantly younger and healthier but had a higher incidence of peritonitis. Use of laparoscopy was significantly lower in Colombia (5.9% vs 89.4%; P <.0001). After adjustment for covariates, multivariable logistic regression analyses revealed that compared to the United States, Colombia had lower complication rates (2.8% vs 6.6%; odds ratio [OR], 0.41; 95% confidence interval [CI], 0.39-0.44; P <.0001) but higher mortality (0.44% vs 0.08%; OR, 8.92; 95% CI, 5.69-13.98; P <.0001) and failure to rescue (13.6% vs 1.0%; OR, 17.01; 95% CI, 10.66-27.16; P <.0001). CONCLUSIONS: Despite lower rates of postoperative complications, in-hospital mortality after appendectomy was higher in Colombia than in the United States. This difference may be explained by higher rates of failure to rescue in the low-to-middle-income country (ie, decreased ability of Colombian hospitals to rescue patients from complications). © 2022 International Anesthesia Research Society.";Failure to Rescue and Mortality Differences after Appendectomy in a Low-Middle-Income Country and the United States;Rosero E.B., Eslava-Schmalbach J., Garzon-Orjuela N., Buitrago G., Joshi G.P.;2023;Anesthesia and Analgesia;0;10.1213/ANE.0000000000006336;https://www.scopus.com/inward/record.uri?eid=2-s2.0-85159765323&doi=10.1213%2fANE.0000000000006336&partnerID=40&md5=d4b3f9dc5a70c6921493ba5e3a5bacec;"Department of Anesthesiology and Pain Management, University of Texas Southwestern Medical Center, Dallas, TX, United States; Health Equity Research Group, School of Medicine, Universidad Nacional de Colombia, Bogotá, Colombia; Clinical Research Institute, School of Medicine, Universidad Nacional de Colombia, Bogotá, Colombia";;"acute appendicitis; adult; aged; appendectomy; Article; Colombia; comorbidity; controlled study; failure to rescue (health care); female; Florida; high income country; hospital discharge; human; in-hospital mortality; laparoscopy; low income country; major clinical study; male; middle income country; mortality; mortality rate; New York; peritonitis; postoperative complication; sensitivity analysis; surgical mortality; United States; appendectomy; appendicitis; hospital; laparoscopy; length of stay; postoperative complication; retrospective study; treatment outcome; United States; Adult; Appendectomy; Appendicitis; Florida; Hospitals; Humans; Laparoscopy; Length of Stay; Postoperative Complications; Retrospective Studies; Treatment Outcome; United States";"acute appendicitis;adult;aged;appendectomy;Article;Colombia;comorbidity;controlled study;failure to rescue (health care);female;Florida;high income country;hospital discharge;human;in-hospital mortality;laparoscopy;low income country;major clinical study;male;middle income country;mortality;mortality rate;New York;peritonitis;postoperative complication;sensitivity analysis;surgical mortality;United States;appendicitis;hospital;length of stay;retrospective study;treatment outcome;Hospitals;Humans;Postoperative Complications;Retrospective Studies";"United States;Colombia";"Colombia: Databases of the Contributaroy Regime of the Social Security System in Health of Colombia; NY, FL - State Inpatient Databses and Ambulatory Surgery and Services Databases";Tabular;Open;No;2 USA, 3 Colombia;yes
137;"This study aimed to assess the prevalence of non-use of health services in the last year by people with Chagas disease (CD) in an endemic area in Brazil and the contextual and individual factors associated with this non-use. This is a multilevel study that considered contextual and individual data. Contextual data were collected from official publicly accessible databases of the Brazilian government, at the municipal level. The individual data came from the first follow-up of a Brazilian cohort that assessed patients with CD in 21 municipali-ties in endemic area for the disease. The sample consisted of 1,160 individuals with CD. The dependent variable “use of health services in the last year” was categorized as yes vs. no. The analysis was performed using Poisson regression with robust variance. The prevalence of non-use of health services in the last year was 23.5% (IC95%: 21.1–25.9). The contextual factor “larger population” (PR: 1.6; 95% CI = 1.2–2.0) and individual factors related to the lower severity of the disease as a functional class without limitations (PR: 1.6; 95% CI = 1.2–2.1) and unaltered N-terminal pro b-type natriuretic peptide levels (PR: 2.2; 95% CI = 1.3–3.6) increased the prevalence of non-use of the health service in the last year by people with CD. The results of this study showed that individual determinants are not isolated pro-tagonists of the non-use of health services in the last year by people with CD, which rein-forces the need for public policies that consider the contextual determinants of the use of health services by populations affected by the disease. © 2022 Damasceno et al.";Failure to use health services by people with Chagas disease: Multilevel analysis of endemic area in Brazil;Damasceno R.F., Sabino E.C., Ribeiro A.L.P., Ferreira A.M., de Oliveira-Da Silva L.C., Oliveira C.D.L., Cardoso C.S., Vieira T.M., Haikal D.S.A.;2022;PLoS Neglected Tropical Diseases;0;10.1371/journal.pntd.0010785;https://www.scopus.com/inward/record.uri?eid=2-s2.0-85139380485&doi=10.1371%2fjournal.pntd.0010785&partnerID=40&md5=104f047b250bba57a142a8f649e7f767;"Graduate Program in Health Sciences, State University of Montes Claros, Minas Gerais, Montes Claros, Brazil; Institute of Tropical Medicine, University of São Paulo, São Paulo, Brazil; Department of Internal Medicine, Federal University of Minas Gerais, Minas Gerais, Belo Horizonte, Brazil; Federal University of São João del-Rey, Research Group in Epidemiology and New Technologies in Health–Centro Oeste Campus, Minas Gerais, Divinópolis, Brazil";;"amino terminal pro brain natriuretic peptide; brain natriuretic peptide; adult; alcohol consumption; Article; Chagas disease; cohort analysis; controlled study; daily life activity; dependent variable; diabetes mellitus; electrocardiogram; endemic disease; female; follow up; health insurance; health service; human; hypertension; IC95; income; lifestyle; major clinical study; male; middle aged; multilevel analysis; physical activity; Poisson regression; prevalence; quality of life; self report; smoking; telehealth; Trypanosoma cruzi; vulnerability; Brazil; Chagas disease; cross-sectional study; health service; multilevel analysis; socioeconomics; Brazil; Chagas Disease; Cross-Sectional Studies; Health Services; Humans; Multilevel Analysis; Natriuretic Peptide, Brain; Socioeconomic Factors";"amino terminal pro brain natriuretic peptide;brain natriuretic peptide;adult;alcohol consumption;Article;Chagas disease;cohort analysis;controlled study;daily life activity;dependent variable;diabetes mellitus;electrocardiogram;endemic disease;female;follow up;health insurance;health service;human;hypertension;IC95;income;lifestyle;major clinical study;male;middle aged;multilevel analysis;physical activity;Poisson regression;prevalence;quality of life;self report;smoking;telehealth;Trypanosoma cruzi;vulnerability;Brazil;cross-sectional study;socioeconomics;Cross-Sectional Studies;Health Services;Humans;Natriuretic Peptide, Brain;Socioeconomic Factors";Brazil;"Atlas of Human Development in Brazil (Atlas de Desenvolvimento Humano no Brasil - AtlasBr); Ministry of Health (Ministerio de Saude - MS); Brazilian Institute of Geography and Stastictics - Cities (Instituto Brasileiro de Geografia e Estatistica - Cidades - IBGE Cidades)";Tabular;Open;No;9 Brazil;yes
138;"Rationale and objective: The burden of breast cancer has increased worldwide. Breast cancer mortality has been increasing in Central and South America (CSA) in the last few decades. We describe the current burden of breast cancer in CSA and review the current status of disease control. Methods: We obtained regional-and national-level incidence data from 48 population-based cancer registries in 13 countries and cancer deaths from the WHO mortality database for 18 countries. We estimated world population age-standardized incidence and mortality rates per 100,000 person-years for 2003-2007 and the estimated annual percentage change to describe time trends. Results: In the most recent 5-year period, Argentina, Brazil, and Uruguay had the highest incidence rates (67.7-71.9) and Bolivia and El Salvador had the lowest (7.9-12.7). For most countries, mortality rates were <= 12.3, except in Uruguay, Argentina and Cuba (14.9-20.5). Age-specific rates increased after the age of 40-50 years and reached a maximum after age 65 years (mean age at diagnosis 56-62 years). Most countries have developed national screening guidelines; however, there is limited capacity for screening. Conclusion: The geographic variation of breast cancer rates may be explained by differences in the prevalence of reproductive patterns, lifestyle factors, early detection, and healthcare access. Extending early-detection programs is challenging because of inequalities in healthcare access and coverage, limited funding, and inadequate infrastructure, and thus it may not be feasible. Given the current status of breast cancer in CSA, data generated by population-based cancer registries is urgently needed for effective planning for cancer control. (C) 2015 International Agency for Research on Cancer; Licensee Elsevier Ltd. This is an open access article under the CC BY-NC-ND IGO 3.0 license.";Female breast cancer in Central and South America;Di Sibio, A., Abriata, G., Forman, D., Sierra, M.S.;2016;CANCER EPIDEMIOLOGY;28;10.1016/j.canep.2016.08.010;;"[Di Sibio, Alejandro; Abriata, Graciela] Natl Canc Inst, Buenos Aires, DF, Argentina; [Forman, David; Sierra, Monica S.] Int Agcy Res Canc, Sect Canc Surveillance, Lyon, France";"Breast; Neoplasm; Screening; Central and South America";"LATIN-AMERICA; PHYSICAL-ACTIVITY; RISK-FACTORS; NUTRITION TRANSITION; MORTALITY-RATES; CERVICAL-CANCER; GLOBAL PATTERNS; LOW-INCOME; TRENDS; DIAGNOSIS";"Breast;Neoplasm;Screening;Central and South America;LATIN-AMERICA;PHYSICAL-ACTIVITY;RISK-FACTORS;NUTRITION TRANSITION;MORTALITY-RATES;CERVICAL-CANCER;GLOBAL PATTERNS;LOW-INCOME;TRENDS;DIAGNOSIS";"Argentina;France";"""48 population-based cancer registries in 13 countries and nationwide cancer deaths from the WHO mortality database for 18 countries"" -  Presumably includes Argentina, Bolivia, Brazil, Chile, Colombia, Ecuador, French Guyana, Paraguay, Peru, Suriname, Uruguay, Venezuela";Tabular;Open;No;2 Argentina, 2 France;yes
141;Most countries are reopening or considering lifting the stringent prevention policies such as lockdowns, consequently, daily coronavirus disease (COVID-19) cases (confirmed, recovered and deaths) are increasing significantly. As of July 25th, there are 16.5 million global cumulative confirmed cases, 9.4 million cumulative recovered cases and 0.65 million deaths. There is a tremendous necessity of supervising and estimating future COVID-19 cases to control the spread and help countries prepare their healthcare systems. In this study, time-series models - Auto-Regressive Integrated Moving Average (ARIMA) and Seasonal Auto-Regressive Integrated Moving Average (SARIMA) are used to forecast the epidemiological trends of the COVID-19 pandemic for top-16 countries where 70%-80% of global cumulative cases are located. Initial combinations of the model parameters were selected using the auto-ARIMA model followed by finding the optimized model parameters based on the best fit between the predictions and test data. Analytical tools Auto-Correlation function (ACF), Partial Auto-Correlation Function (PACF), Akaike Information Criterion (AIC) and Bayesian Information Criterion (BIC) were used to assess the reliability of the models. Evaluation metrics Mean Absolute Error (MAE), Mean Square Error (MSE), Root Mean Square Error (RMSE) and Mean Absolute Percent Error (MAPE) were used as criteria for selecting the best model. A case study was presented where the statistical methodology was discussed in detail for model selection and the procedure for forecasting the COVID-19 cases of the USA. Best model parameters of ARIMA and SARIMA for each country are selected manually and the optimized parameters are then used to forecast the COVID-19 cases. Forecasted trends for confirmed and recovered cases showed an exponential rise for countries such as the United States, Brazil, South Africa, Colombia, Bangladesh, India, Mexico and Pakistan. Similarly, trends for cumulative deaths showed an exponential rise for countries Brazil, South Africa, Chile, Colombia, Bangladesh, India, Mexico, Iran, Peru, and Russia. SARIMA model predictions are more realistic than that of the ARIMA model predictions confirming the existence of seasonality in COVID-19 data. The results of this study not only shed light on the future trends of the COVID-19 outbreak in top-16 countries but also guide these countries to prepare their health care policies for the ongoing pandemic. The data used in this work is obtained from publicly available John Hopkins University's COVID-19 database. (C) 2021 Elsevier B.V. All rights reserved.;Forecasting the dynamics of cumulative COVID-19 cases (confirmed, recovered and deaths) for top-16 countries using statistical machine learning models: Auto-Regressive Integrated Moving Average (ARIMA) and Seasonal Auto-Regressive Integrated Moving Average (SARIMA);ArunKumar, K.E., Kalaga, D.V., Kumar, C.M.S., Chilkoor, G., Kawaji, M., Brenza, T.M.;2021;APPLIED SOFT COMPUTING;80;10.1016/j.asoc.2021.107161;;"[ArunKumar, K. E.; Brenza, Timothy M.] South Dakota Sch Mines & Technol, Dept Chem & Biol Engn, Rapid City, SD 57701 USA; [Kalaga, Dinesh V.; Kawaji, Masahiro] CUNY, Mech Engn Dept, New York, NY 10031 USA; [Kumar, Ch. Mohan Sai] CSIR Cent Inst Med & Aromat Plants, Proc Chem & Technol, Lucknow 226015, Uttar Pradesh, India; [Chilkoor, Govinda] South Dakota Sch Mines & Technol, Dept Civil & Environm Engn, Rapid City, SD 57701 USA; [Brenza, Timothy M.] South Dakota Sch Mines & Technol, Biomed Engn Program, Rapid City, SD 57701 USA";"COVID-19; Statistical modeling; Pandemic; ARIMA SARIMA; Time-series forecast; Auto-Correlation Function (ACF); Akaike Information Criteria (AIC); Bayesian Information Criterion (BIC)";SPREAD;"COVID-19;Statistical modeling;Pandemic;ARIMA SARIMA;Time-series forecast;Auto-Correlation Function (ACF);Akaike Information Criteria (AIC);Bayesian Information Criterion (BIC);SPREAD";"United States;India";John Hopkins COVID-19 database - includes Brazil, Colombia, Chile;Tabular;Open;No;5 USA, 1 India;no
