Index;Abstract;Title;Authors;Year;Source title;Cited by;DOI;Link;Affiliations;Author Keywords;Index Keywords;bothKeywords;country;Dataset name;Data type;open or credentialed;Own Dataset;Authors Nationality;SA authors
79;Fact-checking verifies a multitude of claims and remains a promising solution to fight fake news. The spread of rumors, hoaxes, and conspiracy theories online is evident in times of crisis, when fake news ramped up across platforms, increasing fear and confusion among the population as seen in the COVID-19 pandemic. This article explores fact-checking initiatives in Latin America, using an original Markov-based computational method to cluster topics on tweets and identify their diffusion between different datasets. Drawing on a mixture of quantitative and qualitative methods, including time-series analysis, network analysis and in-depth close reading, our article proposes an in-depth tracing of COVID-related false information across the region, comparing if there is a pattern of behavior through the countries. We rely on the open Twitter application programming interface connection to gather data from public accounts of the six major fact-checking agencies in Latin America, namely Argentina (Chequeado), Brazil (Agência Lupa), Chile (Mala Espina Check), Colombia (Colombia Check from Consejo de Redacciín), Mexico (El Sabueso from Animal Polótico) and Venezuela (Efecto Cocuyo). In total, these profiles account for 102,379 tweets that were collected between January and July 2020. Our study offers insights into the dynamics of online information dissemination beyond the national level and demonstrates how politics intertwine with the health crisis in this period. Our method is capable of clustering topics in a period of overabundance of information, as we fight not only a pandemic but also an infodemic, evidentiating opportunities to understand and slow the spread of false information. © 2021, The Author(s), under exclusive licence to Springer-Verlag GmbH Austria, part of Springer Nature.;COVID-19 fake news diffusion across Latin America;Ceron W., Gruszynski Sanseverino G., de-Lima-Santos M.F., Quiles M.G.;2021;Social Network Analysis and Mining;21;10.1007/s13278-021-00753-z;https://www.scopus.com/inward/record.uri?eid=2-s2.0-85106274858&doi=10.1007%2fs13278-021-00753-z&partnerID=40&md5=52d409e380d16dbe8b35a98ee4ff9204;"Federal University of Sao Paulo, Av. Cesare Mansueto Giulio Lattes, São José dos Campos, 1201, Brazil; University of Toulouse III - Paul Sabatier, 115d Route De Narbonne, Toulouse Cedex 4, 31077, France; University of Navarra, Campus Universitario s/n, Pamplona, Spain";"Fact-checking; Fake news; Infodemic; Latin America; Pandemic; Twitter";"Application programming interfaces (API); Computation theory; Information dissemination; Argentina; Health crisis; Latin America; National level; Public accounts; Quantitative and qualitative methods; Slow the spread; Venezuela; Time series analysis";"Fact-checking;Fake news;Infodemic;Latin America;Pandemic;Twitter;Application programming interfaces (API);Computation theory;Information dissemination;Argentina;Health crisis;National level;Public accounts;Quantitative and qualitative methods;Slow the spread;Venezuela;Time series analysis";Venezuela, Brasil, Chile, Colombia;- Twitter API;Text;Open;No;"Brazil;France;Spain";yes
81;Objective. The aim of this study is to describe the mortality among older adults in the first wave of COVID-19 in Colombia and Mexico. Methods. This is an observational, prospective study on data obtained from open data sets that are publicly available on the websites of the health ministries of the respective countries. COVID-19 cases, age, sex, date to mortality, and mortality itself were analyzed with Kaplan-Meier curves and Cox regressions. Results. Data on 1 779 877 individuals were analyzed, 58.2% from Mexico, with a higher frequency of men for both countries, and 11.7% were older adults. Survival curves show a continuous increase in mortality for Mexico, with higher rates for older adults, while for Colombia the mortality was observed up to 50 days of the follow-up. Finally, hazard ratios were higher for older adults in both countries. Colombia implemented a rigid curfew for older adults, and the effect on mortality is clear from the survival curves. Conclusions. This finding shows the potential benefit that public policies could have on older adults. © 2021 Pan American Health Organization. All rights reserved.;COVID-19 related mortality in older adults: Analysis of the first wave in Colombia and Mexico;Perez-Zepeda M.U., Campos-Fajardo S., Cano-Gutierrez C.;2021;Revista Panamericana de Salud Publica/Pan American Journal of Public Health;3;10.26633/RPSP.2021.109;https://www.scopus.com/inward/record.uri?eid=2-s2.0-85114893814&doi=10.26633%2fRPSP.2021.109&partnerID=40&md5=0d7e2ab5415d24c65098a10403e57e0e;"Instituto Nacional de Geriatría, Mexico City, Mexico; Pontificia Universidad Javeriana, Bogotá, Colombia; Hospital Universitario San Ignacio, Bogotá, Colombia";"Aged; Colombia; COVID-19; Cross-cultural comparison; Epidemiology; Mexico";"adult; COVID-19; elderly population; health policy; mortality; survival; adult; age; Article; clinical outcome; Colombia; comparative study; coronavirus disease 2019; curfew; descriptive research; female; follow up; human; major clinical study; male; Mexico; mortality; mortality rate; observational study; pandemic; prospective study; secondary analysis; senescence; sex; survival rate; Colombia; Mexico [North America]";"Aged;Colombia;COVID-19;Cross-cultural comparison;Epidemiology;Mexico;adult;elderly population;health policy;mortality;survival;age;Article;clinical outcome;comparative study;coronavirus disease 2019;curfew;descriptive research;female;follow up;human;major clinical study;male;mortality rate;observational study;pandemic;prospective study;secondary analysis;senescence;sex;survival rate;Mexico [North America]";"Mexico;Colombia";Covid cases form Colombian Ministry of Health (https://covid19.minsalud.gov.co/);Tabular;Open;No;"Mexico;Colombia";yes
82;"Background This is an exploratory analysis of potential variables associated with open Roux-en-Y gastric bypass (RYGB) surgery hospitalization resource use pattern. Methods Cross-sectional study based on an administrative database (DATASUS) records. Inclusion criteria were adult patients undergoing RYGB between Jan/2008 and Jun/2011. Dependent variables were length of stay (LoS) and ICU need. Independent variables were: gender, age, region, hospital volume, surgery at certified center of excellence (CoE) by the Surgical Review Corporation (SRC), teaching hospital, and year of hospitalization. Univariate and multivariate analysis (logistic regression for ICU need and linear regression for length of stay) were performed. Results Data from 13,069 surgeries were analyzed. In crude analysis, hospital volume was the most impactful variable associated with log-transformed LoS (1.312 +/- 0.302 high volume vs. 1.670 +/- 0.581 low volume, p < 0.001), whereas for ICU need it was certified CoE (odds ratio (OR), 0.016; 95 % confidence interval (CI), 0.010-0.026). After adjustment by logistic regression, certified CoE remained as the strongest predictor of ICU need (OR, 0.011; 95 % CI, 0.007-0.018), followed by hospital volume (OR, 3.096; 95 % CI, 2.861-3.350). Age group, male gender, and teaching hospital were also significantly associated (p < 0.001). For log-transformed LoS, final model includes hospital volume (coefficient, -0.223; 95 % CI, -0.250 to -0.196) and teaching hospital (coefficient, 0.375; 95 % CI, 0.351-0.398). Region of Brazil was not associated with any of the outcomes. Conclusions High-volume hospital was the strongest predictor for shorter LoS, whereas SRC certification was the strongest predictor of lower ICU need. Public health policies targeting an increase of efficiency and patient access to the procedure should take into account these results.";Cross-sectional Study of Variables Associated with Length of Stay and ICU Need in Open Roux-En-Y Gastric Bypass Surgery for Morbid Obese Patients: An Exploratory Analysis Based on the Public Health System Administrative Database (Datasus) in Brazil;Asano, E.F., Rasera, I., Shiraga, E.C.;2012;OBESITY SURGERY;3;10.1007/s11695-012-0695-z;;"[Asano, Elio Fernando] Johnson & Johnson Med Brasil, Hlth Econ & Market Access Dept, Sao Paulo, Brazil; [Rasera, Irineu, Jr.; Shiraga, Elisabete Cristina] Hosp Fornecedores Cana, Gastroenterol & Obes Surg Ctr, Clin Bariatr, Piracicaba, Brazil";"Gastric bypass; Bariatric surgery; Outcome assessment; Length of stay; Intensive care units; Cost-benefit analysis; Hospital bed capacity; Hospital administration; Efficiency, organizational";"ACADEMIC MEDICAL-CENTERS; SHORT-TERM OUTCOMES; BARIATRIC SURGERY; HOSPITAL VOLUME; NATIONAL TRENDS; CANCER-SURGERY; CARE; MORTALITY; QUALITY; EXCELLENCE";"Gastric bypass;Bariatric surgery;Outcome assessment;Length of stay;Intensive care units;Cost-benefit analysis;Hospital bed capacity;Hospital administration;Efficiency, organizational;ACADEMIC MEDICAL-CENTERS;SHORT-TERM OUTCOMES;HOSPITAL VOLUME;NATIONAL TRENDS;CANCER-SURGERY;CARE;MORTALITY;QUALITY;EXCELLENCE";Brazil;- Brazilian Public Health System Database (DATASUS) (https://datasus.saude.gov.br/);Tabular;Open;No;Brazil;yes
85;Understanding the fine scale spatial distribution of births and pregnancies is crucial for informing planning decisions related to public health. This is especially important in lower income countries where infectious disease is a major concern for pregnant women and new-borns, as highlighted by the recent Zika virus epidemic. Despite this, the spatial detail of basic data on the numbers and distribution of births and pregnancies is often of a coarse resolution and difficult to obtain, with no co-ordination between countries and organisations to create one consistent set of subnational estimates. To begin to address this issue, under the framework of the WorldPop program, an open access archive of high resolution gridded birth and pregnancy distribution datasets for all African, Latin America and Caribbean countries has been created. Datasets were produced using the most recent and finest level census and official population estimate data available and are at a resolution of 30 arc seconds (approximately 1 km at the equator). All products are available through WorldPop. © 2018 The Author(s).;Data Descriptor: Gridded birth and pregnancy datasets for Africa, Latin America and the Caribbean;James W.H.M., Tejedor-Garavito N., Hanspal S.E., Campbell-Sutton A., Hornby G.M., Pezzulo C., Nilsen K., Sorichetta A., Ruktanonchai C.W., Carioli A., Kerr D., Matthews Z., Tatem A.J.;2018;Scientific Data;13;10.1038/sdata.2018.90;https://www.scopus.com/inward/record.uri?eid=2-s2.0-85047626523&doi=10.1038%2fsdata.2018.90&partnerID=40&md5=647f129de68475163de24c3718b52b4c;"WorldPop, Geography and Environment, University of Southampton, Highfield Campus, Southampton, SO17 1BJ, United Kingdom; Flowminder Foundation, Roslagsgatan 17, Stockholm, SE-11355, Sweden; GeoData, University of Southampton, Highfield Campus, Southampton, SO17 1BJ, United Kingdom; Division of Social Statistics and Demography, Centre for Global Health Population, Poverty and Policy, Faculty of Social and Human Sciences, University of Southampton, Southampton, SO17 1BJ, United Kingdom";;"Africa; Caribbean; female; human; live birth; maternal welfare; pregnancy; pregnancy complication; South and Central America; Zika fever; Zika virus; Africa; Caribbean Region; Female; Humans; Latin America; Live Birth; Maternal Health; Pregnancy; Pregnancy Complications, Infectious; Zika Virus; Zika Virus Infection";"Africa;Caribbean;female;human;live birth;maternal welfare;pregnancy;pregnancy complication;South and Central America;Zika fever;Zika virus;Caribbean Region;Humans;Latin America;Maternal Health;Pregnancy Complications, Infectious;Zika Virus Infection";Argentina, Bolivia, Brazil, Chile, Colombia, Ecuador, Guyane, Guyana, Paraguay, Peru, Suriname, Uruguay, Venezuela;Latin America and the Caribbean (LAC) population dataset https://hub.worldpop.org/doi/10.5258/SOTON/WP00138;Geotiff;Open;Yes;"United Kingdom;Sweden";no
86;This study aims to identify patterns in maternal and fetal characteristics in the prediction of infant mortality by incorporating innovative techniques like data mining, with proven relevance for public health. A database was developed with infant deaths from 2000 to 2004 analyzed by the Committees for the Prevention of Infant Mortality, based on integration of the Information System on Live Births (SINASC), Mortality Information System, and Investigation of Infant Mortality in the State of Parana. The data mining software was WEKA (open source). The data mining conducts a database search and provides rules to be analyzed to transform the data into useful information. After mining, 4,230 rules were selected: teenage pregnancy plus birth weight < 2,500g, or post-term birth plus teenage mother with a previous child or intercurrent conditions increase the risk of neonatal death. The results highlight the need for greater attention to teenage mothers, newborns with birth weight < 2,500g, post-term neonates, and infants of mothers with intercurrent conditions, thus corroborating other studies.;Data mining and characteristics of infant mortality;Vianna, R.C.X.F., Moro, C.M.C.D., Moyses, S.J., Carvalho, D., Nievola, J.C.;2010;CADERNOS DE SAUDE PUBLICA;12;10.1590/S0102-311X2010000300011;;"[Xavier Ferreira Vianna, Rossana Cristina] Secretaria Estado Saude Parana, BR-80230140 Curitiba, Parana, Brazil; [Xavier Ferreira Vianna, Rossana Cristina; Cabral de Barra Moro, Claudia Maria; Moyses, Samuel Jorge; Carvalho, Deborah; Nievola, Julio Cesar] Pontificia Univ Catolica Parana, Programa Posgrad Tecnol Saude, Curitiba, Parana, Brazil; [Moyses, Samuel Jorge] Secretaria Municipal Saude Curitiba, Curitiba, Parana, Brazil; [Carvalho, Deborah] Univ Tuiuti, Inst Paranaense Desenvolvimento Econ & Social, Curitiba, Parana, Brazil";"Database; Infant Mortality; Information Systems; Artificial Intelligence; Epidemiologic Surveillance";"BRAZIL; FETAL";"Database;Infant Mortality;Information Systems;Artificial Intelligence;Epidemiologic Surveillance;BRAZIL;FETAL";Brazil;Information System on Live Births (SINASC);Tabular;Open;No;Brazil;yes
87;"This paper presents data collected through a questionnaire for the estimation of body dysmorphic disorder known as vigorexy, weight level and levels of exercise dependence in individuals from Barranquilla, Colombia who attend local gyms, based on their physical activity, food supplements eat-ing habits, psychological pressure, and risk of muscle dys-morphia. The Data contains 8 tributes and 200 records; la-belling obesity range according to WHO into normal, over-weight or obesity. All data was collected in person and di-rectly from users. This data can be used to generate scien-tific research and intelligent computational tools to identify the obesity level and muscle dysmorphia risk of an individ-ual and to build recommender systems that monitor health and mental status. (c) 2020 The Author(s). Published by Elsevier Inc. This is an open access article under the CC BY license. (http://creativecommons.org/licenses/by/4.0/ )";Dataset for estimation of muscle Dysmorphia in individuals from Colombia;Isaac, K., Consuegra, J., Jimenez, J., Lopez, E., Hernandez, J., Norena-Pena, A.;2020;DATA IN BRIEF;0;10.1016/j.dib.2020.105967;;"[Isaac, Kuzmar; Consuegra, Jose; Jimenez, Jezael; Lopez, Einer; Hernandez, Jose] Simon Bolivar Univ Colombia, Cl 58 55-132, Barranquilla, Atlantico, Colombia; [Norena-Pena, Ana] Univ Alicante, Alicante 03690, Spain";"Body dysmorphic disorder; Food supplement; Obesity; Overweight";RISK;"Body dysmorphic disorder;Food supplement;Obesity;Overweight;RISK";Colombia;"Kuzmar, Isaac (2020), “Data for: Dataset for estimation of muscle dysmorphia in
individuals from Colombia”, Mendeley Data, v1 http://dx.doi.org/10.17632/8652jgm7p5.1";Tabular;Open;Yes;"Colombia;Spain";yes
88;Due to the increasing prevalence of obesity and its negative consequences worldwide on public health, body composition analysis is a central pillar to assess the nutritional status. Scientists could use datasets to develop a new body fat measurement formula. Using bioelectrical impedance analysis, we analyzed the total body composition of 345 patients (234 men and 111 women) aged between 18 and 60 years residing in the metropolitan area of Barranquilla, Colombia. They have the potential for predictive formula analysis enhancing the cooperation among scientists. Due to the obesity pandemic, new datasets from other populations are needed to develop a body fat basic mathematical equation formula that could be used worldwide to determine the prevalence of overweight and obesity in a specific population group predisposed to develop metabolic syndrome or death, secondary to high cardiovascular risk. (c) 2020 The Author(s). Published by Elsevier Inc. This is an open access article under the CC BY license (http://creativecommons.org/licenses/by/4.0/);Dataset for the estimation of a new body fat measurement method;Kuzmar, I., Arroyo, J.R.M., Villanueva, M.A.C., Ortega, L.V.S., Cortissoz, G.S.G., Bandera, X.P.G., Zalabata, E.;2021;DATA IN BRIEF;1;10.1016/j.dib.2020.106656;;"[Kuzmar, Isaac; Merlano Arroyo, Jose Rafael; Cantillo Villanueva, Manuel Andres; Sevilla Ortega, Laura Vanessa; Goenaga Cortissoz, Gloria Sthefanny; Granados Bandera, Xelenys Paola] Univ Simon Bolivar, Fac Ciencias Salud, Barranquilla, Colombia; [Zalabata, Eliana] Fdn Univ Area Andina, Valledupar, Colombia";;;;Colombia;"Kuzmar, Isaac; Zalabata, orcid.org/0000–0002–3662–4371 (2020):
DATASET FOR NEW BODY FAT MEASUREMENT. figshare. Dataset.
https://doi.org/10.6084/m9.figshare.12982223.v2";Tabular;Open;Yes;Colombia;yes
90;We present a machine-readable and open-access dataset on vaccination results among children under five years old in Brazil from 1996 to 2021. This dataset is interoperable with epidemiological data from the VAX*SIM project and reusable by the research community worldwide for other purposes, such as monitoring vaccination coverage and studying its determinants and impacts on child morbidity and mortality. The dataset gathers official and public information from the Brazilian National Immunisation Program, the Institute of Geography and Statistics, the Institute for Applied Economic Research, and the Ministry of Health. It includes 2,442,863 observations and 35 attributes aggregated by years, policy-relevant geographic units (country, macroregions, states, municipalities, and capitals), and age groups on 1,344,480,329 doses of 28 vaccines aimed to prevent 15 diseases, estimates of their target-population coverage, indicators of the vaccination coverage's homogeneity, dropout rates, and spatial, demographic, and socioeconomic data. We automated all data processing and curation in the free and open software R. The codes can be audited, replicated, and reused to produce alternative analyses.;Dataset on child vaccination in Brazil from 1996 to 2021;Boccolini, P.D.M., Boccolini, C.S., Relvas-Brandt, L.D., Alves, R.F.S.;2023;SCIENTIFIC DATA;0;10.1038/s41597-023-01939-0;;"[Boccolini, Patricia de Moraes Mello; Boccolini, Cristiano Siqueira; Relvas-Brandt, Lais de Almeida; Alves, Ronaldo Fernandes Santos] Fundacao Oswaldo Cruz, Inst Sci & Technol Commun & Informat Hlth, Rio De Janeiro, RJ, Brazil; [Boccolini, Patricia de Moraes Mello] Petropolis Med Sch, Ctr Informat, Publ Pol & Social Inclus, NIPPIS, Petropolis, RJ, Brazil";;;;Brazil;Data Resource Profile: Brazil's National Immunization Program vaccination results in children under five years old, 1996-2021. https://www.synapse.org/#!Synapse:syn26453964;Tabular;Open;Yes;Brazil;yes
94;Pancreatic cancer is one of the leading causes of deaths. At later stages, it is impossible to cure. However, if the early symptoms of cancer are identified using diagnostic methods, there is a possibility of treatment and gradual cure. In order to aid in the diagnosis of cancer of the pancreas, the application of Artificial Intelligence was viewed as a solution. Initially, various machine learning algorithms like Support Vector Machines, Twin Support Vector Machines and RadSTM-ER were used, yielding encouraging results. However, the arduous process of feature extraction and manual feature selection resulted in researchers turning towards deep learning methods. This research work uses ultrasound images of the pancreas obtained from an open sourced database by the gastroenterology unit of National University of Colombia. The implementation was carried out using transfer learning on Densely Connected Convolutional Neural Networks (DenseNets). DenseNet201 using pretrained weights of ImageNet was fine-tuned on 26469 pancreatic ultrasound images consisting of three categories: cancer, healthy and pancreatitis. Additionally, cross validation on 2940 images yielded an accuracy of 99.87 %. Apart from this, 9804 images of the same distribution were used to test the performance. The DenseNet201 model was able to yield an accuracy of 99.877 %, a sensitivity of 0.9987, a specificity of 0.99931 and a positive prediction value of 0.99877, with only 12 out of 9804 misclassified examples. The ability of deep transfer learning on DenseNet201 to generalize exceedingly well encourages its beta testing on real time data and subsequent deployment. © 2021 IEEE.;Deep Transfer Learning for Pancreatic Cancer Detection;Baldota S., Sharma S., Malathy C.;2021;2021 12th International Conference on Computing Communication and Networking Technologies, ICCCNT 2021;1;10.1109/ICCCNT51525.2021.9580000;https://www.scopus.com/inward/record.uri?eid=2-s2.0-85126196577&doi=10.1109%2fICCCNT51525.2021.9580000&partnerID=40&md5=d5cb97056537b3ac9397647544e5110a;Department of Computer Science and Engineering, SRM Institute of Science and Technology, Kattankulathur603203, India;"Deep Learning; DenseNets; Fine tuning; Pancreatic Cancer; Transfer Learning";"Convolutional neural networks; Curing; Deep learning; Feature extraction; Learning algorithms; Support vector machines; Ultrasonic applications; Cancer detection; Causes of death; Convolutional neural network; Deep learning; Densely connected convolutional neural network; Fine tuning; Late stage; Pancreatic cancers; Transfer learning; Ultrasound images; Diseases";"Deep Learning;DenseNets;Fine tuning;Pancreatic Cancer;Transfer Learning;Convolutional neural networks;Curing;Feature extraction;Learning algorithms;Support vector machines;Ultrasonic applications;Cancer detection;Causes of death;Convolutional neural network;Densely connected convolutional neural network;Late stage;Pancreatic cancers;Ultrasound images;Diseases";Colombia;Endoscopic ultrasound database of the pancreas. http://cimalab.unal.edu.co/?lang=es&mod=program&id=26;Images - B-mode Ultrasound;Open;No;India;no
